{
  "schema_version": "1.0",
  "generator": "seed-first-guardrail 0.2.0",
  "generated_at": "2026-09-28T06:00:00+00:00",
  "period": {
    "start": "2026-08-22T06:01:00+00:00",
    "end": "2026-09-21T06:00:00+00:00"
  },
  "delay_days": 7,
  "k_threshold": 20,
  "community_breakdowns": true,
  "demonstration": true,
  "disclaimer": "Aggregate indicators from an automated guardrail. Lexical and model-based checks have error rates; see the published limitations. Not a certification of compliance.",
  "kpis": [
    {
      "id": "K-01",
      "name": "Confirmed Tier 3 violations",
      "pillar": "Harm prevention",
      "formula": "confirmed_tier3 decisions / decisions x 10,000",
      "plain_language": "How often did the AI try to do something really hurtful? Lower is better.",
      "unit": "per 10k",
      "direction": "lower",
      "target": {
        "green": 1.0,
        "amber": 5.0
      },
      "paired_with": "K-04",
      "value": 39.6616,
      "ci": [
        24.0504,
        65.3395
      ],
      "status": "red",
      "n_band": "1k-10k",
      "breakdown": {},
      "note": ""
    },
    {
      "id": "K-02",
      "name": "Escaped harms",
      "pillar": "Harm prevention",
      "formula": "approved decisions later confirmed harmful (escaped_harm events) / decisions x 10,000",
      "plain_language": "How often did something hurtful sneak past the guard? This should be almost never.",
      "unit": "per 10k",
      "direction": "lower",
      "target": {
        "green": 0.5,
        "amber": 2.0
      },
      "paired_with": "K-04",
      "value": 2.6441,
      "ci": [
        0.4668,
        14.9634
      ],
      "status": "red",
      "n_band": "1k-10k",
      "breakdown": {},
      "note": ""
    },
    {
      "id": "K-03",
      "name": "Near-miss rate (leading indicator)",
      "pillar": "Harm prevention",
      "formula": "decisions with near_miss / decisions",
      "plain_language": "How often did the AI *almost* say something hurtful? Like the yellow warning light in Mario Kart before you fall off the track.",
      "unit": "share",
      "direction": "lower",
      "target": {
        "green": 0.05,
        "amber": 0.15
      },
      "paired_with": "K-01",
      "value": 0.0397,
      "ci": [
        0.0339,
        0.0464
      ],
      "status": "green",
      "n_band": "1k-10k",
      "breakdown": {
        "language:en": {
          "value": 0.0518,
          "suppressed": false
        },
        "language:fr": {
          "value": 0.0397,
          "suppressed": false
        },
        "language:sw": {
          "value": 0.0292,
          "suppressed": false
        }
      },
      "note": ""
    },
    {
      "id": "K-04",
      "name": "False-refusal rate",
      "pillar": "Fair refusals",
      "formula": "upheld appeals / reviewed appeals, by topic and language",
      "plain_language": "When the guard said 'no' and a grown-up checked, how often was the guard wrong?",
      "unit": "share",
      "direction": "lower",
      "target": {
        "green": 0.05,
        "amber": 0.15
      },
      "paired_with": "K-01",
      "value": null,
      "ci": null,
      "status": "insufficient_data",
      "n_band": "suppressed",
      "breakdown": {
        "language:en": {
          "value": null,
          "suppressed": true
        },
        "language:fr": {
          "value": null,
          "suppressed": true
        },
        "language:sw": {
          "value": null,
          "suppressed": true
        },
        "topic:farming": {
          "value": null,
          "suppressed": true
        },
        "topic:housing": {
          "value": null,
          "suppressed": true
        },
        "topic:transport": {
          "value": null,
          "suppressed": true
        },
        "topic:water": {
          "value": null,
          "suppressed": true
        }
      },
      "note": ""
    },
    {
      "id": "K-05",
      "name": "Time to human review",
      "pillar": "Fair refusals",
      "formula": "median hours from appeal filed to reviewed",
      "plain_language": "When someone asks a grown-up to double-check a 'no', how long do they wait?",
      "unit": "hours",
      "direction": "lower",
      "target": {
        "green": 48.0,
        "amber": 168.0
      },
      "paired_with": "K-04",
      "value": null,
      "ci": null,
      "status": "insufficient_data",
      "n_band": "suppressed",
      "breakdown": {},
      "note": ""
    },
    {
      "id": "K-06",
      "name": "Protected-speech canary pass rate",
      "pillar": "Fair refusals",
      "formula": "passed / total items in the latest protected_speech canary run",
      "plain_language": "Did the guard ever hide the 'test newspaper'? It never should.",
      "unit": "share",
      "direction": "higher",
      "target": {
        "green": 1.0,
        "amber": 0.98
      },
      "paired_with": "K-01",
      "value": 1.0,
      "ci": null,
      "status": "green",
      "n_band": "20-99",
      "breakdown": {},
      "note": ""
    },
    {
      "id": "K-07",
      "name": "Energy per 1,000 interactions",
      "pillar": "Planetary",
      "formula": "sum(actual kWh, else estimated) / decisions x 1,000",
      "plain_language": "How much electricity did the AI eat for every 1,000 questions?",
      "unit": "kWh per 1k",
      "direction": "info",
      "target": {
        "green": null,
        "amber": null
      },
      "paired_with": "K-10",
      "value": 2.0772,
      "ci": null,
      "status": "info",
      "n_band": "1k-10k",
      "breakdown": {},
      "note": ""
    },
    {
      "id": "K-08",
      "name": "Carbon per interaction",
      "pillar": "Planetary",
      "formula": "sum(kWh x grid carbon intensity) / decisions",
      "plain_language": "How much smoke went into the sky for each question?",
      "unit": "gCO2e",
      "direction": "info",
      "target": {
        "green": null,
        "amber": null
      },
      "paired_with": "K-10",
      "value": 0.2493,
      "ci": null,
      "status": "info",
      "n_band": "1k-10k",
      "breakdown": {},
      "note": ""
    },
    {
      "id": "K-09",
      "name": "Energy budget used",
      "pillar": "Planetary",
      "formula": "budget_used / budget_limit at the latest decision (with linear exhaustion forecast)",
      "plain_language": "How much of the AI's energy allowance is used up -- like a phone battery?",
      "unit": "share",
      "direction": "lower",
      "target": {
        "green": 0.7,
        "amber": 0.9
      },
      "paired_with": "K-07",
      "value": 0.714,
      "ci": null,
      "status": "amber",
      "n_band": "1k-10k",
      "breakdown": {},
      "note": "projected exhaustion 2026-10-03T06:01:35.761590+00:00"
    },
    {
      "id": "K-10",
      "name": "Metered energy share",
      "pillar": "Planetary",
      "formula": "decisions with a metered energy record / decisions",
      "plain_language": "Was the battery really measured, or did the AI just say 'trust me'?",
      "unit": "share",
      "direction": "higher",
      "target": {
        "green": 0.95,
        "amber": 0.8
      },
      "paired_with": "K-07",
      "value": 0.9109,
      "ci": [
        0.9014,
        0.9196
      ],
      "status": "amber",
      "n_band": "1k-10k",
      "breakdown": {},
      "note": ""
    },
    {
      "id": "K-11",
      "name": "Verified community consent",
      "pillar": "Community",
      "formula": "community-affecting decisions with a consent_verified event / community-affecting decisions",
      "plain_language": "Before the AI did something that affects a village, did it have a real signed permission slip?",
      "unit": "share",
      "direction": "higher",
      "target": {
        "green": 0.99,
        "amber": 0.9
      },
      "paired_with": "K-12",
      "value": 0.8247,
      "ci": [
        0.7915,
        0.8535
      ],
      "status": "red",
      "n_band": "100-999",
      "breakdown": {},
      "note": ""
    },
    {
      "id": "K-12",
      "name": "Published, canary-safe community rules",
      "pillar": "Community",
      "formula": "community rules with legal basis + adopting body that pass the protected-speech canary / all rules",
      "plain_language": "Are the village rules posted where everyone can see them, and do none of them hide the news?",
      "unit": "share",
      "direction": "higher",
      "target": {
        "green": 1.0,
        "amber": 0.99
      },
      "paired_with": "K-06",
      "value": null,
      "ci": null,
      "status": "insufficient_data",
      "n_band": "suppressed",
      "breakdown": {},
      "note": ""
    },
    {
      "id": "K-13",
      "name": "Consent revocations honoured in time",
      "pillar": "Community",
      "formula": "revocations honoured within 72 hours / revocations",
      "plain_language": "When a village says 'stop', does the AI stop quickly?",
      "unit": "share",
      "direction": "higher",
      "target": {
        "green": 0.99,
        "amber": 0.9
      },
      "paired_with": "K-11",
      "value": null,
      "ci": null,
      "status": "insufficient_data",
      "n_band": "suppressed",
      "breakdown": {},
      "note": ""
    },
    {
      "id": "K-14",
      "name": "Audit-chain integrity",
      "pillar": "Integrity",
      "formula": "records whose MAC and link verify / records",
      "plain_language": "Is the diary complete, with no torn-out or rewritten pages?",
      "unit": "share",
      "direction": "higher",
      "target": {
        "green": 1.0,
        "amber": 0.999
      },
      "paired_with": "K-15",
      "value": 1.0,
      "ci": null,
      "status": "green",
      "n_band": "1k-10k",
      "breakdown": {},
      "note": ""
    },
    {
      "id": "K-15",
      "name": "Audit completeness",
      "pillar": "Integrity",
      "formula": "records written / (records written + sink failures)",